{
  "tenantId": "tenant_123",
  "repository": "contentRepository",
  "draftRef": "copy_draft_01",
  "version": 1,
  "sourceAction": "create_copy_variants",
  "content": {
    "variants": [
      {
        "id": "var_a_copy_v1",
        "role": "reference",
        "angle": "operational_productivity",
        "headline": "Organize a operação de marketing em um só fluxo.",
        "primaryText": "Conecte estratégia, execução e aprendizado com governança.",
        "cta": "request_demo"
      },
      {
        "id": "var_b_copy_v1",
        "role": "challenger",
        "angle": "unattributed_revenue",
        "headline": "Quanto da sua aquisição realmente vira pipeline?",
        "primaryText": "Conecte investimento, pipeline e receita sem ocultar limitações de atribuição.",
        "cta": "request_demo"
      }
    ]
  },
  "resolvedAt": "2026-09-21T13:01:25Z"
}
